{"format_version": 1, "promotion_id": "promo_t", "source": {"chapter_id": "chapter_000001", "chapter_sha256": "aaaaaaaaaaaaaaaaaaaaaaaaaaaaaaaaaaaaaaaaaaaaaaaaaaaaaaaaaaaaaaaa"}, "extracted_by": "t", "review_id": "r", "reviewed_by": "h", "entities": [{"entity_id": "e_loc", "entity_type": "location", "canonical_name": "L", "aliases": [], "source_candidate_id": "sl", "claims": [{"claim_id": "c1", "predicate": "type", "value": {"kind": "enum", "enum_value": "v"}, "source_chapters": ["chapter_000001"], "source_support": "explicit", "certainty": "certain", "inference_basis": null, "review_reason": "o."}]}, {"entity_id": "e_char", "entity_type": "character", "canonical_name": "C", "aliases": [], "source_candidate_id": "sc", "claims": [{"claim_id": "c2", "predicate": "origin", "value": {"kind": "text", "text": "o."}, "source_chapters": ["chapter_000001"], "source_support": "explicit", "certainty": "certain", "inference_basis": null, "review_reason": "o."}]}, {"entity_id": "e_item", "entity_type": "item", "canonical_name": "I", "aliases": [], "source_candidate_id": "si", "claims": [{"claim_id": "c3", "predicate": "desc", "value": {"kind": "text", "text": "d."}, "source_chapters": ["chapter_000001"], "source_support": "explicit", "certainty": "certain", "inference_basis": null, "review_reason": "o."}]}, {"entity_id": "e_x", "entity_type": "character", "canonical_name": "X", "aliases": [], "source_candidate_id": "sx", "claims": [{"claim_id": "c4", "predicate": "origin", "value": {"kind": "text", "text": "x."}, "source_chapters": ["chapter_000001"], "source_support": "explicit", "certainty": "certain", "inference_basis": null, "review_reason": "o."}]}, {"entity_id": "e_y", "entity_type": "character", "canonical_name": "Y", "aliases": [], "source_candidate_id": "sy", "claims": [{"claim_id": "c5", "predicate": "origin", "value": {"kind": "text", "text": "y."}, "source_chapters": ["chapter_000001"], "source_support": "explicit", "certainty": "certain", "inference_basis": null, "review_reason": "o."}]}]}
